{
  "trait_code": "TR-1505",
  "label": "Occhi Analizzatori di Tensione",
  "famiglia_tipologia": "Sensoriale/Visivo",
  "fattore_mantenimento_energetico": "Basso",
  "tier": "T2",
  "slot": [],
  "sinergie": [
    "TR-1502"
  ],
  "conflitti": [],
  "requisiti_ambientali": [
    {
      "capacita_richieste": [],
      "condizioni": {
        "biome_class": "terrestre"
      },
      "fonte": "envo_mapping",
      "meta": {
        "tier": "T2",
        "notes": ""
      }
    }
  ],
  "mutazione_indotta": "Retina sensibile alla polarizzazione.",
  "uso_funzione": "Leggere tensioni nella seta e pattern di stress.",
  "spinta_selettiva": "Ottimizzare riparazioni e trappole.",
  "metrics": [
    {
      "name": "acuita_visiva",
      "value": 0.92,
      "unit": "1"
    }
  ],
  "cost_profile": {
    "rest": "Basso",
    "burst": "Medio",
    "sustained": "Basso"
  },
  "testability": {
    "observable": "Rileva filo scarico vs carico",
    "scene_prompt": "Test scelta su trame con diversa polarizzazione"
  },
  "applicability": {
    "clades": [],
    "envo_terms": [
      "http://purl.obolibrary.org/obo/ENVO_01000228"
    ]
  },
  "version": "2.0.0",
  "versioning": {
    "created": "2025-11-04",
    "updated": "2025-11-04",
    "author": "Master DD / GPT-5 Pro"
  }
}