{
  "trait_code": "TR-1105",
  "label": "Organi Sismici Cutanei",
  "famiglia_tipologia": "Sensoriale/Tatto-Vibro",
  "fattore_mantenimento_energetico": "Basso",
  "tier": "T2",
  "slot": [],
  "sinergie": [
    "TR-1101"
  ],
  "conflitti": [
    "TR-1103"
  ],
  "requisiti_ambientali": [
    {
      "capacita_richieste": [],
      "condizioni": {
        "biome_class": "terrestre"
      },
      "fonte": "envo_mapping",
      "meta": {
        "tier": "T2",
        "notes": ""
      }
    }
  ],
  "mutazione_indotta": "Squame con lamelle meccano-recettive.",
  "uso_funzione": "Percepire vibrazioni del suolo.",
  "spinta_selettiva": "Predazione in copertura e notturna.",
  "metrics": [
    {
      "name": "soglia_udito",
      "value": 20,
      "unit": "dB"
    }
  ],
  "cost_profile": {
    "rest": "Basso",
    "burst": "Medio",
    "sustained": "Basso"
  },
  "testability": {
    "observable": "Individua passi entro 15 m",
    "scene_prompt": "Sabbiera vibrata: segnala direzione corretta"
  },
  "applicability": {
    "clades": [],
    "envo_terms": [
      "http://purl.obolibrary.org/obo/ENVO_01000178"
    ]
  },
  "version": "2.0.0",
  "versioning": {
    "created": "2025-11-04",
    "updated": "2025-11-04",
    "author": "Master DD / GPT-5 Pro"
  }
}